Task,Category
respond to urgent it ticket,urgent important
watch old cartoon,not-urgent not-important
read assigned book chapter,not-urgent important
find out when the next student council meeting is,urgent not-important
try a new style of music,not-urgent not-important
design internal presentation template,not-urgent not-important
schedule faculty meeting,urgent not-important
browse study tip,not-urgent not-important
organize semester study material,not-urgent not-important
sort lecture slide,not-urgent not-important
forward the meeting minute to the project team,urgent not-important
schedule peer review,urgent not-important
pay the outstanding electricity bill,urgent important
prepare holiday schedule,not-urgent important
launch new product,urgent important
attend academic success workshop,not-urgent important
finalize the marketing campaign for the product launch,urgent important
check company announcement,urgent not-important
make a list of upcoming birthday to remember,not-urgent important
confirm lunch order,urgent not-important
hydrate and take medicine a prescribed,urgent important
review meeting note,urgent not-important
refresh task template for future use,not-urgent important
confirm submission detail for thesis,urgent not-important
check internship deadline,not-urgent important
read assigned textbook and research article,not-urgent important
book sport facility,urgent not-important
schedule yearly checkup,
handle the insurance claim process for the car accident,urgent important
prepare a presentation for tomorrow’s class,urgent not-important
order more printer paper for the office,urgent not-important
write thank-you email to client,not-urgent important
take photo of nature,not-urgent not-important
organize backpack for next day,not-urgent not-important
update personal budget for the month,not-urgent important
replace whiteboard marker,
check for new software update on your computer,not-urgent not-important
attend team meeting,urgent important
update cloud storage layout,not-urgent not-important
create study reward system,not-urgent not-important
organize email inbox,urgent not-important
complete annual review,not-urgent important
back up important file,not-urgent important
create an academic portfolio to track achievement,not-urgent not-important
set up a personal website or blog,not-urgent important
review note from last lecture,not-urgent important
design company swag item,not-urgent not-important
review course outline for missing detail,urgent not-important
reorder business card,not-urgent not-important
confirm the shipment to the supplier,urgent important
follow up on project deadline,urgent important
summarize key takeaway from training session,not-urgent important
finalize the agenda for the leadership strategy retreat,urgent important
debug and fix bug in existing code,urgent important
watch a random documentary,not-urgent not-important
create virtual team room,not-urgent not-important
finalize the preparation for the university event,urgent important
submit the lab report before the deadline,urgent important
ask professor about extra credit,urgent not-important
create intellectual property strategy,not-urgent important
stay updated with latest trend and tool in data science,not-urgent important
review the team performance metric by tomorrow night,urgent important
prepare the stakeholder report for next day’s session,urgent important
improve customer experience,urgent important
design company event theme,not-urgent not-important
prepare resume for career fair,urgent important
complete online course,not-urgent important
send rsvp for dinner,
return borrowed office material,urgent not-important
update office calendar,urgent not-important
schedule the team briefing for tomorrow morning,urgent important
look up study strategy for exam,urgent not-important
notify work/school about absence,urgent important
create study productivity log,not-urgent not-important
check professor’s feedback on project,urgent not-important
organize your university email and communication,not-urgent not-important
attend mandatory class session,urgent important
take an online personality quiz,not-urgent not-important
attend the emergency team meeting to discus the critical issue,urgent important
track progress toward goal,not-urgent important
practice language skill with partner,not-urgent important
attend a virtual cooking class,not-urgent not-important
check pantry and fridge for existing item,not-urgent important
check fridge for expired item,urgent not-important
create team avatar,not-urgent not-important
schedule thesis defense,urgent important
mentor junior staff,not-urgent important
email professor about office hour,urgent not-important
create exam schedule,not-urgent not-important
organize the training schedule for tomorrow morning,urgent important
develop a corrective action plan for identified process gap,urgent important
organize study apps,not-urgent not-important
research client success story,not-urgent important
interact with family or friend,not-urgent important
improve customer support,urgent important
conduct risk analysis and develop contingency plan,not-urgent important
find new study tip to improve exam performance,not-urgent not-important
take a break and look at industry news online,not-urgent not-important
set up meeting reminder,urgent not-important
review last semester's grade,not-urgent not-important
complete final exam registration,urgent important
browse online shopping,not-urgent not-important
find study material online for your course,not-urgent not-important
network building,not-urgent important
update phone contact,urgent not-important
review and plan the next semester�s course selection,not-urgent important
update student email preference,urgent not-important
check the university�s job portal for internship opportunity,not-urgent important
check stock price,not-urgent not-important
organize the team-building activity for the department,urgent important
review progress on team goal,not-urgent important
check software license renewal,not-urgent important
read news article,not-urgent not-important
complete lab safety training,urgent important
write documentation and comment code for clarity,not-urgent important
call for air conditioner repair,urgent not-important
watch travel vlogs,not-urgent not-important
submit your essay to the professor via email,urgent not-important
organize your work desk,not-urgent not-important
resolve legal dispute deadline,urgent important
write outline for term paper,not-urgent important
prepare for client presentation,urgent important
check attendance record,urgent not-important
look for open spot in popular course,urgent not-important
pick up the prescription from the pharmacy after work,urgent important
sort receipt for the expense report,not-urgent important
research office decor idea for a comfortable workspace,not-urgent not-important
review app integration,not-urgent not-important
prepare weekly status report,urgent important
take part in a campus volunteer opportunity,not-urgent not-important
prepare feedback form,
submit the revised version of the thesis proposal,urgent important
study for upcoming quiz,urgent not-important
organize note for an upcoming presentation,not-urgent important
address the urgent compliance request from the regulatory body,urgent important
check out new student discount for local store,not-urgent not-important
ensure quality control and standard are followed,urgent important
look up the weather forecast for the week,urgent not-important
clean your shoe or organize your closet,not-urgent important
evaluate team performance and provide constructive feedback,not-urgent important
buy extra ink for printer,urgent not-important
"eat light, nutritious meal for energy",not-urgent important
replace the broken window in the living room,urgent important
find a study buddy for an upcoming project,not-urgent not-important
create a detailed study plan for final,not-urgent important
review the course material for the upcoming test,urgent not-important
watch random stand-up comedy clip,not-urgent not-important
research professional certification,not-urgent important
check study resource,not-urgent not-important
remind yourself to submit the online quiz by midnight,urgent not-important
organize digital screenshots,not-urgent not-important
schedule library workshop,urgent not-important
create data visualization and report for stakeholder,not-urgent important
design revision timetable,not-urgent not-important
update study checklist,not-urgent not-important
update study schedule design,not-urgent not-important
design office artwork,not-urgent not-important
prepare the group presentation slide before tomorrow,urgent important
review annual financial statement,not-urgent important
call for a delivery update,
read up on personal development book,not-urgent important
prepare the handout for the seminar attendee,urgent important
confirm team lunch slot,
clean workspace,urgent not-important
organize study flashcard,not-urgent not-important
prepare for midterm,urgent important
contact service for light,
research scholarship option,not-urgent important
review the stakeholder comment in 1 hour,urgent important
fill out personal expense form,not-urgent not-important
watch educational video for self-improvement,not-urgent important
watch online motivational speech for student,not-urgent not-important
submit weekly reflection journal,urgent important
create team spirit contest,not-urgent not-important
check if ac is working,
build credit score,not-urgent important
exercise regularly,not-urgent important
design study corner,not-urgent not-important
prepare project timeline,not-urgent important
design note template,not-urgent not-important
submit weekly progress report,urgent important
update linkedin profile,urgent not-important
respond to the request for an urgent blood donation,urgent important
practice mindfulness or meditation,not-urgent important
look for volunteering opportunity on campus,urgent not-important
browse study motivation quote,not-urgent not-important
create study routine checklist,not-urgent not-important
order toner for printer,urgent not-important
check for upcoming local event or festival,not-urgent important
run monthly report on kpis,not-urgent important
monitor brand reputation online,not-urgent important
check availability of textbook,urgent not-important
develop new product idea,not-urgent important
finish the group project before the meeting with the professor,urgent important
grab cable for projector,urgent not-important
respond to the inquiry about the team’s workload capacity,urgent important
look up volunteer opportunity on campus,urgent not-important
review project task,urgent not-important
customize chat bot appearance,not-urgent not-important
fetch coffee for meeting,
organize team building event,urgent not-important
organize your digital academic portfolio,not-urgent important
complete quarterly financial report,urgent important
draft minute from last team meeting,urgent not-important
arrange for office chair delivery,urgent not-important
sort browser bookmark,not-urgent not-important
schedule regular meeting,urgent not-important
visit professor during office hour,not-urgent important
respond to the invoice discrepancy from the supplier,urgent important
check thesis submission deadline,urgent not-important
find holiday decoration,
update study apps,not-urgent not-important
shower and get ready for the day,not-urgent important
prepare the material for the peer teaching session,urgent important
create team building game,not-urgent not-important
brainstorm team retreat idea,not-urgent important
find new tool to improve office organization,not-urgent not-important
organize study material,not-urgent important
buy the birthday gift for a loved one,urgent important
submit the proposal for the local government initiative,urgent important
confirm field trip detail,urgent not-important
brainstorm new idea,not-urgent important
look for academic journal for research project,not-urgent not-important
create assignment checklist,not-urgent not-important
organize your course material for easy access,not-urgent not-important
search for transport strike update,urgent not-important
check social medium for important update,urgent not-important
submit the finalized project budget by tomorrow afternoon,urgent important
submit the draft of the press release for the launch event,urgent important
write down study goal,not-urgent not-important
organize personal finance,not-urgent important
finalize the training material for the onboarding session,urgent important
revisit syllabus for course requirement,urgent not-important
read a book on leadership,not-urgent important
attend the town hall meeting to discus community issue,urgent important
go to a museum,not-urgent not-important
find missing stapler,urgent not-important
submit plagiarism declaration,urgent important
buy office snack,
sign up for research seminar,urgent not-important
prepare for final group project presentation,not-urgent important
browse study gadget,not-urgent not-important
work on model interpretability and explainability,not-urgent important
clean coffee machine,
submit the work portfolio for the appraisal process,urgent important
browse study room decor,not-urgent not-important
prepare the financial summary for the non-profit audit,urgent important
plan a picnic with friend or family,not-urgent important
collect feedback on product launch,not-urgent important
clean browser history,not-urgent not-important
listen to an audiobook,not-urgent not-important
review the legal document for the project agreement,urgent important
look up old friend on facebook,not-urgent not-important
be patient with yourself,not-urgent important
pay the electricity bill before it’s due,urgent not-important
check email for urgent message,urgent not-important
organize pencil case,not-urgent not-important
update client contract,urgent not-important
rearrange your bookshelf,not-urgent not-important
confirm campus event registration,urgent not-important
research for homework,not-urgent important
update course calendar,urgent not-important
confirm ride to office,
join an online study community to collaborate with peer,not-urgent not-important
create team recognition badge,not-urgent not-important
forward the invoice,
revisit past exam for practice,urgent not-important
develop talent pipeline strategy,not-urgent important
prepare a quick report on the financial status of the project,urgent important
develop sale strategy,not-urgent important
plan automation strategy,not-urgent important
order new office furniture,not-urgent not-important
test communication tool for efficiency,not-urgent important
re-watch old tv show,not-urgent not-important
find out about student research opportunity,urgent not-important
send project update to stakeholder,urgent important
share a funny meme with friend,not-urgent not-important
check projector for client meeting,urgent not-important
make a grocery list based on meal plan,urgent important
attend extra lab practice session,urgent important
submit the project proposal by tomorrow morning,urgent important
update office amenity guide,not-urgent not-important
replace the leaking pipe in the kitchen immediately,urgent important
customize department letterhead,not-urgent not-important
design revision plan,not-urgent not-important
submit casual expense form,
book meeting room,urgent not-important
share an interesting link,
check for announcement on campus event schedule,urgent not-important
read random blog post,not-urgent not-important
practice problem set,not-urgent important
update class material,urgent not-important
create study timeline design,not-urgent not-important
create and send the invoice to the client,urgent important
schedule an oil change for your car,urgent not-important
rearrange seating for meeting,urgent not-important
finalize the essay revision before submission,urgent important
update resume for job search,urgent not-important
sort through draft folder,not-urgent not-important
pick up your laundry from the dry cleaner before closing,urgent not-important
attend study group session,urgent important
review the feedback from the manager in 3 hour,urgent important
sign up for the upcoming workshop on academic writing,urgent not-important
practice coding problem,not-urgent important
ask ta for clarification on lecture material,urgent not-important
send the application for the scholarship,urgent important
organize your study material by subject,not-urgent not-important
organize study material and workspace,not-urgent important
confirm lunch order for office meeting,urgent not-important
prepare a presentation,urgent important
set up a study corner or home office,not-urgent important
watch a lecture recording for revision,not-urgent not-important
look for volunteer work related to your field of study,not-urgent important
write team appreciation message,not-urgent not-important
confirm lunch location and time,urgent not-important
order new business card,not-urgent not-important
take dance or yoga class,not-urgent important
organize old email,not-urgent not-important
ensure data security and compliance with privacy regulation,not-urgent important
summarize key point for retention,not-urgent important
finish the report for the research project,urgent important
review the critical incident report in 3 hour,urgent important
respond to urgent email,urgent not-important
call for door handle repair,urgent not-important
write down your thought on recent personal experience,not-urgent important
present insight and finding to non-technical stakeholder,urgent not-important
write case study for recent project,not-urgent important
design study milestone tracker,not-urgent not-important
remind team about filing expense report,urgent not-important
update your work email signature,not-urgent not-important
check competitor pricing,not-urgent important
learn a new software tool,not-urgent important
update study music genre,not-urgent not-important
schedule the performance review meeting for tomorrow evening,urgent important
update client portfolio,not-urgent not-important
set long-term academic goal for your degree program,not-urgent important
deploy app to app store/play store (if applicable),not-urgent important
review current project status,not-urgent important
practice presentation,not-urgent important
organize employee training document,not-urgent important
confirm registration for next semester’s elective course,urgent not-important
review and update project schedule regularly,urgent important
scroll through pinterest for new idea,not-urgent not-important
review note and study for homework,not-urgent important
complete your application for the study abroad program,urgent not-important
submit extra credit form,urgent not-important
design review schedule,not-urgent not-important
automate repetitive data processing task,not-urgent important
organize study material for the exam,urgent important
create study ambiance,not-urgent not-important
organize digital folder,not-urgent not-important
draft response template,not-urgent important
find a part-time job or internship opportunity,not-urgent important
schedule the car repair appointment,urgent important
make a scrapbook,not-urgent not-important
organize office supply cabinet,not-urgent not-important
check study abroad application status,urgent not-important
take a break and relax with tea,not-urgent not-important
finalize the product design change for the upcoming release,urgent important
submit the urgent purchase requisition today,urgent important
stay hydrated and have snack,not-urgent important
attend conference,not-urgent important
look for online study resource,urgent not-important
organize digital photo,not-urgent not-important
schedule the follow-up call with the vendor for next day,urgent important
build technical skill,not-urgent important
check university’s event calendar for social event,not-urgent not-important
ask about late submission policy,urgent not-important
prepare the logistics framework for seasonal demand,urgent important
regular health checkup,not-urgent important
remind team about lunch,
cleaning the bathroom,urgent important
send out new hire welcome email,urgent important
read about new research being conducted in your field,not-urgent not-important
create quarterly project plan,not-urgent important
browse through study abroad program offered by the university,not-urgent not-important
look up class study resource,not-urgent not-important
pay the electricity bill before the due date,urgent important
ask about university health service,urgent not-important
check weekend weather forecast,urgent not-important
complete the audit report for the fiscal year,urgent important
respond to customer complaint,urgent important
organize group study session for a difficult subject,not-urgent important
send email to professor about missing class note,urgent not-important
finish the essay for the history class,urgent important
attend the lecture to finalize the project,urgent important
sort study website,not-urgent not-important
design study habit tracker,not-urgent not-important
plan a weekend movie marathon,not-urgent important
review the draft legal agreement with the compliance team,urgent important
finalize the design for tomorrow’s product unveiling,urgent important
renew software subscription,not-urgent important
search for part-time job opportunity on campus,not-urgent not-important
read about office ergonomics for a better workspace,not-urgent not-important
confirm attendance at upcoming conference,urgent important
confirm presentation schedule,urgent not-important
organize class note,not-urgent not-important
start a new exercise routine,not-urgent important
review application requirement for scholarship,urgent not-important
try out new recipe,not-urgent not-important
listen to music for relaxation,not-urgent not-important
schedule a virtual meeting with a classmate to discus note,urgent not-important
follow academic conference or workshop relevant to your study,not-urgent important
clean dorm room,not-urgent not-important
get enough sleep,not-urgent important
update company directory,urgent not-important
participate in a student organization meeting,not-urgent important
schedule office maintenance,not-urgent important
remind group member about the project deadline tomorrow,urgent not-important
draft new marketing plan,not-urgent important
prepare for tomorrow's presentation,urgent important
complete the customer survey analysis,urgent important
respond to data breach incident,urgent important
review syllabus for any change to due date,urgent not-important
complete lab experiment report,urgent important
practice writing academic paper and essay,not-urgent important
plan a campus event or activity for student,not-urgent not-important
review course syllabus for missing info,urgent not-important
build data pipeline for efficient data flow,urgent important
customize notification setting,not-urgent not-important
set up a meeting invite,
organize research paper,not-urgent not-important
collect printed document,
prepare and deliver presentation to share insight with executive,not-urgent important
strategic planning session,not-urgent important
prepare the presentation for the client meeting,urgent important
update team on project status,urgent not-important
plan desk decoration,
finalize the customer feedback report for presentation,urgent important
look up quiz detail,urgent not-important
"design the app ui/ux (wireframes, mockups)",not-urgent important
update study room lighting,not-urgent not-important
review the data migration result for accuracy check,urgent important
look for internship opportunity,urgent not-important
resolve the issue affecting the customer database,urgent important
plan a visit to a university open house or research symposium,not-urgent important
update study focus timer,not-urgent not-important
order flower for upcoming event,not-urgent not-important
submit contract revision,urgent important
set up a reminder alert,
revise the study guide for the final exam,urgent important
resolve server downtime,urgent important
complete scholarship application,urgent important
create exam study guide,not-urgent important
ask for an extension on assignment due tomorrow,urgent not-important
notify cleaner for spill,
book study room in library,urgent not-important
create an exam study guide,not-urgent important
professional development course,not-urgent important
reorganize your bookmark on the browser,not-urgent not-important
handle the customer complaint that requires immediate attention,urgent important
preventive maintenance,not-urgent important
complete office maintenance request,urgent important
set reminder for exam date,not-urgent important
search for funny meme on instagram,not-urgent not-important
join study group,not-urgent important
conduct the necessary revision for the product guide,urgent important
organize dorm room,not-urgent not-important
write history essay,urgent important
do laundry,not-urgent not-important
update personal study planner,urgent not-important
compile the key metric for the leadership update session,urgent important
participate in extracurricular activity and leadership program,not-urgent not-important
write up the note from today’s class for the group,urgent not-important
research essay topic,not-urgent important
review study flashcard,not-urgent important
check course registration portal,urgent not-important
confirm group member availability for project work,urgent not-important
look up current traffic condition,urgent not-important
design note-taking system,not-urgent not-important
sort old assignment paper,not-urgent not-important
create email filter,not-urgent not-important
look for project material,urgent not-important
